{
  "collector": "tools/dev/bun.sh extensions/tools/check-extension-model.mjs --write-evidence",
  "evidenceTier": "transitional-catalog-smoke",
  "id": "2026-06-07-transitional-catalog-smoke",
  "notes": "Transitional evidence imported from extensions.smoke.toml while per-recipe evidence runs are introduced.",
  "observedAt": "2026-06-07T00:00:00Z",
  "results": [
    {
      "artifactFamily": "wasix-runtime",
      "extension": "amcheck",
      "platformTarget": "portable",
      "postgresMajor": 18,
      "runtimeModeStatuses": {
        "direct": "passed",
        "dump-restore": "passed",
        "restart": "passed",
        "server": "passed"
      },
      "sqlName": "amcheck"
    },
    {
      "artifactFamily": "wasix-runtime",
      "extension": "auto_explain",
      "platformTarget": "portable",
      "postgresMajor": 18,
      "runtimeModeStatuses": {
        "direct": "passed",
        "dump-restore": "passed",
        "restart": "passed",
        "server": "passed"
      },
      "sqlName": "auto_explain"
    },
    {
      "artifactFamily": "wasix-runtime",
      "extension": "bloom",
      "platformTarget": "portable",
      "postgresMajor": 18,
      "runtimeModeStatuses": {
        "direct": "passed",
        "dump-restore": "passed",
        "restart": "passed",
        "server": "passed"
      },
      "sqlName": "bloom"
    },
    {
      "artifactFamily": "wasix-runtime",
      "extension": "btree_gin",
      "platformTarget": "portable",
      "postgresMajor": 18,
      "runtimeModeStatuses": {
        "direct": "passed",
        "dump-restore": "passed",
        "restart": "passed",
        "server": "passed"
      },
      "sqlName": "btree_gin"
    },
    {
      "artifactFamily": "wasix-runtime",
      "extension": "btree_gist",
      "platformTarget": "portable",
      "postgresMajor": 18,
      "runtimeModeStatuses": {
        "direct": "passed",
        "dump-restore": "passed",
        "restart": "passed",
        "server": "passed"
      },
      "sqlName": "btree_gist"
    },
    {
      "artifactFamily": "wasix-runtime",
      "extension": "citext",
      "platformTarget": "portable",
      "postgresMajor": 18,
      "runtimeModeStatuses": {
        "direct": "passed",
        "dump-restore": "passed",
        "restart": "passed",
        "server": "passed"
      },
      "sqlName": "citext"
    },
    {
      "artifactFamily": "wasix-runtime",
      "extension": "cube",
      "platformTarget": "portable",
      "postgresMajor": 18,
      "runtimeModeStatuses": {
        "direct": "passed",
        "dump-restore": "passed",
        "restart": "passed",
        "server": "passed"
      },
      "sqlName": "cube"
    },
    {
      "artifactFamily": "wasix-runtime",
      "extension": "dict_int",
      "platformTarget": "portable",
      "postgresMajor": 18,
      "runtimeModeStatuses": {
        "direct": "passed",
        "dump-restore": "passed",
        "restart": "passed",
        "server": "passed"
      },
      "sqlName": "dict_int"
    },
    {
      "artifactFamily": "wasix-runtime",
      "extension": "dict_xsyn",
      "platformTarget": "portable",
      "postgresMajor": 18,
      "runtimeModeStatuses": {
        "direct": "passed",
        "dump-restore": "passed",
        "restart": "passed",
        "server": "passed"
      },
      "sqlName": "dict_xsyn"
    },
    {
      "artifactFamily": "wasix-runtime",
      "extension": "earthdistance",
      "platformTarget": "portable",
      "postgresMajor": 18,
      "runtimeModeStatuses": {
        "direct": "passed",
        "dump-restore": "passed",
        "restart": "passed",
        "server": "passed"
      },
      "sqlName": "earthdistance"
    },
    {
      "artifactFamily": "wasix-runtime",
      "extension": "file_fdw",
      "platformTarget": "portable",
      "postgresMajor": 18,
      "runtimeModeStatuses": {
        "direct": "passed",
        "dump-restore": "passed",
        "restart": "passed",
        "server": "passed"
      },
      "sqlName": "file_fdw"
    },
    {
      "artifactFamily": "wasix-runtime",
      "extension": "fuzzystrmatch",
      "platformTarget": "portable",
      "postgresMajor": 18,
      "runtimeModeStatuses": {
        "direct": "passed",
        "dump-restore": "passed",
        "restart": "passed",
        "server": "passed"
      },
      "sqlName": "fuzzystrmatch"
    },
    {
      "artifactFamily": "wasix-runtime",
      "extension": "hstore",
      "platformTarget": "portable",
      "postgresMajor": 18,
      "runtimeModeStatuses": {
        "direct": "passed",
        "dump-restore": "passed",
        "restart": "passed",
        "server": "passed"
      },
      "sqlName": "hstore"
    },
    {
      "artifactFamily": "wasix-runtime",
      "extension": "intarray",
      "platformTarget": "portable",
      "postgresMajor": 18,
      "runtimeModeStatuses": {
        "direct": "passed",
        "dump-restore": "passed",
        "restart": "passed",
        "server": "passed"
      },
      "sqlName": "intarray"
    },
    {
      "artifactFamily": "wasix-runtime",
      "extension": "isn",
      "platformTarget": "portable",
      "postgresMajor": 18,
      "runtimeModeStatuses": {
        "direct": "passed",
        "dump-restore": "passed",
        "restart": "passed",
        "server": "passed"
      },
      "sqlName": "isn"
    },
    {
      "artifactFamily": "wasix-runtime",
      "extension": "lo",
      "platformTarget": "portable",
      "postgresMajor": 18,
      "runtimeModeStatuses": {
        "direct": "passed",
        "dump-restore": "passed",
        "restart": "passed",
        "server": "passed"
      },
      "sqlName": "lo"
    },
    {
      "artifactFamily": "wasix-runtime",
      "extension": "ltree",
      "platformTarget": "portable",
      "postgresMajor": 18,
      "runtimeModeStatuses": {
        "direct": "passed",
        "dump-restore": "passed",
        "restart": "passed",
        "server": "passed"
      },
      "sqlName": "ltree"
    },
    {
      "artifactFamily": "wasix-runtime",
      "extension": "pageinspect",
      "platformTarget": "portable",
      "postgresMajor": 18,
      "runtimeModeStatuses": {
        "direct": "passed",
        "dump-restore": "passed",
        "restart": "passed",
        "server": "passed"
      },
      "sqlName": "pageinspect"
    },
    {
      "artifactFamily": "wasix-runtime",
      "extension": "pg_buffercache",
      "platformTarget": "portable",
      "postgresMajor": 18,
      "runtimeModeStatuses": {
        "direct": "passed",
        "dump-restore": "passed",
        "restart": "passed",
        "server": "passed"
      },
      "sqlName": "pg_buffercache"
    },
    {
      "artifactFamily": "wasix-runtime",
      "extension": "pg_freespacemap",
      "platformTarget": "portable",
      "postgresMajor": 18,
      "runtimeModeStatuses": {
        "direct": "passed",
        "dump-restore": "passed",
        "restart": "passed",
        "server": "passed"
      },
      "sqlName": "pg_freespacemap"
    },
    {
      "artifactFamily": "wasix-runtime",
      "extension": "pg_hashids",
      "platformTarget": "portable",
      "postgresMajor": 18,
      "runtimeModeStatuses": {
        "direct": "passed",
        "dump-restore": "passed",
        "restart": "passed",
        "server": "passed"
      },
      "sqlName": "pg_hashids"
    },
    {
      "artifactFamily": "wasix-runtime",
      "extension": "pg_ivm",
      "platformTarget": "portable",
      "postgresMajor": 18,
      "runtimeModeStatuses": {
        "direct": "passed",
        "dump-restore": "passed",
        "restart": "passed",
        "server": "passed"
      },
      "sqlName": "pg_ivm"
    },
    {
      "artifactFamily": "wasix-runtime",
      "extension": "pg_surgery",
      "platformTarget": "portable",
      "postgresMajor": 18,
      "runtimeModeStatuses": {
        "direct": "passed",
        "dump-restore": "passed",
        "restart": "passed",
        "server": "passed"
      },
      "sqlName": "pg_surgery"
    },
    {
      "artifactFamily": "wasix-runtime",
      "extension": "pg_textsearch",
      "platformTarget": "portable",
      "postgresMajor": 18,
      "runtimeModeStatuses": {
        "direct": "passed",
        "dump-restore": "passed",
        "restart": "passed",
        "server": "passed"
      },
      "sqlName": "pg_textsearch"
    },
    {
      "artifactFamily": "wasix-runtime",
      "extension": "pg_trgm",
      "platformTarget": "portable",
      "postgresMajor": 18,
      "runtimeModeStatuses": {
        "direct": "passed",
        "dump-restore": "passed",
        "restart": "passed",
        "server": "passed"
      },
      "sqlName": "pg_trgm"
    },
    {
      "artifactFamily": "wasix-runtime",
      "extension": "pg_uuidv7",
      "platformTarget": "portable",
      "postgresMajor": 18,
      "runtimeModeStatuses": {
        "direct": "passed",
        "dump-restore": "passed",
        "restart": "passed",
        "server": "passed"
      },
      "sqlName": "pg_uuidv7"
    },
    {
      "artifactFamily": "wasix-runtime",
      "extension": "pg_visibility",
      "platformTarget": "portable",
      "postgresMajor": 18,
      "runtimeModeStatuses": {
        "direct": "passed",
        "dump-restore": "passed",
        "restart": "passed",
        "server": "passed"
      },
      "sqlName": "pg_visibility"
    },
    {
      "artifactFamily": "wasix-runtime",
      "extension": "pg_walinspect",
      "platformTarget": "portable",
      "postgresMajor": 18,
      "runtimeModeStatuses": {
        "direct": "passed",
        "dump-restore": "passed",
        "restart": "passed",
        "server": "passed"
      },
      "sqlName": "pg_walinspect"
    },
    {
      "artifactFamily": "wasix-runtime",
      "extension": "pgcrypto",
      "platformTarget": "portable",
      "postgresMajor": 18,
      "runtimeModeStatuses": {
        "direct": "passed",